Partido;xG Local;xG Visit;Prob. Over 2.5;Nuestra Cuota;Cuota Casa;¿Hay Valor?
América Mineiro vs Atlético GO;1,36;1,06;0,4355;2,3;2,47;✅ SÍ (+7.6%)
Liverpool FC Montevideo vs Cerro Largo;1,37;1,27;0,4916;2,03;2,11;✅ SÍ (+3.7%)
Kawkab Marrakech vs Raja Casablanca;1,36;1,21;0,474;2,11;2,7;✅ SÍ (+28.0%)
CR Khemis Zemamra vs UTS Rabat;1,15;1,37;0,4613;2,17;2,7;✅ SÍ (+24.6%)
Vila Nova vs Botafogo SP;1,56;1,32;0,5494;1,82;2,25;✅ SÍ (+23.6%)
Olympique Dcheïra vs Hassania Agadir;1,3;1,02;0,4093;2,44;2,5;✅ SÍ (+2.3%)
Yacoub El Mansour vs CODM Meknès;1,44;1,13;0,474;2,11;2,5;✅ SÍ (+18.5%)
Atlético Nacional vs Junior;1,7;1,38;0,5945;1,68;1,7;✅ SÍ (+1.1%)
