Partido;xG Local;xG Visit;Prob. Over 2.5;Nuestra Cuota;Cuota Casa;¿Hay Valor?
Nice vs Metz;1,33;0,88;0,38;2,63;1,57;❌ NO
Real Sociedad vs Valencia CF;1,55;1,08;0,4891;2,04;1,85;❌ NO
Trabzonspor vs Gençlerbirliği;1,76;0,95;0,5088;1,97;1,62;❌ NO
Antalyaspor vs Kocaelispor;1,23;0,96;0,3746;2,67;1,96;❌ NO
Los Chankas vs UCV Moquegua;1,36;1,1;0,4459;2,24;1,67;❌ NO
Leones del Norte vs Mushuc Runa SC;1,04;1,21;0,3907;2,56;2,37;❌ NO
Sportivo San Lorenzo vs Sportivo Luqueño;1,21;1,23;0,4407;2,27;1,93;❌ NO
Real Zaragoza vs Sporting Gijón;1,4;1,13;0,4639;2,16;1,86;❌ NO
Sassuolo vs Lecce;1,18;0,99;0,3692;2,71;2,12;❌ NO
Cagliari vs Torino;1,14;1,2;0,4145;2,41;2,2;❌ NO
Udinese vs Cremonese;1,41;0,94;0,4172;2,4;2,0;❌ NO
Lorient vs Le Havre;1,36;1,17;0,4639;2,16;1,85;❌ NO
Olympique Lyonnais vs Lens;1,54;1,6;0,6074;1,65;1,57;❌ NO
FC Barcelona vs Real Betis;2,11;1,41;0,6828;1,46;1,3;❌ NO
Olympique Marseille vs Rennes;1,77;1,32;0,5967;1,68;1,51;❌ NO
Strasbourg vs Monaco;1,42;1,45;0,5471;1,83;1,44;❌ NO
Lille vs Auxerre;1,73;1,13;0,5447;1,84;1,7;❌ NO
Paris vs PSG;1,46;1,88;0,6485;1,54;1,33;❌ NO
Brest vs Angers SCO;1,44;0,95;0,4277;2,34;1,8;❌ NO
Nantes vs Toulouse;1,3;1,24;0,4664;2,14;1,81;❌ NO
Botafogo vs Corinthians;1,56;0,95;0,4587;2,18;2,15;❌ NO
Kasımpaşa vs Galatasaray;1,27;1,4;0,499;2,0;1,62;❌ NO
Fenerbahçe vs Eyüpspor;2,18;1,05;0,6263;1,6;1,36;❌ NO
Levante UD vs RCD Mallorca;1,52;1,05;0,474;2,11;1,85;❌ NO
Rayo Vallecano vs Villarreal;1,81;1,06;0,5471;1,83;1,75;❌ NO
Kahraba Ismailia vs Haras El Hodood;1,16;1,18;0,4145;2,41;2,2;❌ NO
Pumas UNAM vs Pachuca;1,31;1,47;0,5258;1,9;1,8;❌ NO
Atalanta vs Bologna;1,89;1,21;0,5988;1,67;1,62;❌ NO
Midtjylland vs Brøndby;1,64;1,64;0,6365;1,57;1,53;❌ NO
Concepción vs Everton;1,16;1,08;0,388;2,58;2,2;❌ NO
SønderjyskE vs Nordsjælland;1,37;1,63;0,5768;1,73;1,53;❌ NO
Guabirá vs Nacional Potosí;1,91;1,42;0,6466;1,55;1,47;❌ NO
Newcastle United vs West Ham United;1,67;1,17;0,54;1,85;1,5;❌ NO
Huachipato vs Unión La Calera;1,75;0,95;0,5064;1,97;1,85;❌ NO
Manta FC vs CS Emelec;1,24;0,85;0,3477;2,88;2,26;❌ NO
Inter Miami vs Portland Timbers;2,48;1,33;0,7327;1,36;1,3;❌ NO
Bahia vs Grêmio;1,6;0,96;0,4715;2,12;1,93;❌ NO
Real Oviedo vs Deportivo Alavés;1,18;1,29;0,4485;2,23;1,8;❌ NO
Atlético Madrid vs Girona FC;1,85;1,2;0,5879;1,7;1,7;❌ NO
Bragantino vs Vitória;1,66;0,98;0,4916;2,03;2,0;❌ NO
Sevilla FC vs Real Madrid;1,38;1,85;0,6263;1,6;1,73;✅ SÍ (+8.4%)
Vila Nova vs Avaí;1,54;1,36;0,554;1,8;1,95;✅ SÍ (+8.0%)
Cobresal vs Universidad Chile;1,74;1,17;0,5563;1,8;1,91;✅ SÍ (+6.3%)
Argentinos Juniors vs Belgrano;1,71;1,36;0,5923;1,69;2,7;✅ SÍ (+59.9%)
Deportivo Madryn vs Ferro Carril Oeste;1,31;1,39;0,5064;1,97;3,1;✅ SÍ (+57.0%)
Criciúma vs Atlético GO;2,07;0,93;0,5768;1,73;2,7;✅ SÍ (+55.7%)
Gimnasia y Tiro vs San Martín Tucumán;1,39;1,19;0,4765;2,1;3,25;✅ SÍ (+54.9%)
Gimnasia Jujuy vs Temperley;1,9;1,19;0,5967;1,68;2,59;✅ SÍ (+54.5%)
AEK Athens vs Olympiakos Piraeus;1,7;2,05;0,7229;1,38;2,1;✅ SÍ (+51.8%)
Ceará vs Fortaleza;1,98;1,14;0,6032;1,66;2,5;✅ SÍ (+50.8%)
Viktoria Plzeň vs Jablonec;1,91;1,34;0,6304;1,59;1,68;✅ SÍ (+5.9%)
Nashville SC vs Los Angeles FC;1,78;1,52;0,6406;1,56;1,65;✅ SÍ (+5.7%)
Club Atlético Mitre vs San Miguel;1,31;1,11;0,4355;2,3;3,4;✅ SÍ (+48.1%)
Midland vs Agropecuario;2,07;1,22;0,6386;1,57;2,25;✅ SÍ (+43.7%)
ADT vs Comerciantes Unidos;1,49;1,23;0,5113;1,96;2,05;✅ SÍ (+4.8%)
Elche CF vs Getafe CF;1,59;1,1;0,5039;1,98;2,75;✅ SÍ (+38.6%)
Deportivo Garcilaso vs UTC Cajamarca;1,33;1,37;0,5064;1,97;2,05;✅ SÍ (+3.8%)
AGF vs Viborg;1,83;1,47;0,6406;1,56;1,61;✅ SÍ (+3.1%)
Quilmes vs Tristán Suárez;1,2;1,15;0,4172;2,4;3,1;✅ SÍ (+29.3%)
Deportivo Maipú vs Nueva Chicago;1,77;1,07;0,54;1,85;2,39;✅ SÍ (+29.1%)
Racing vs Cerro Largo;1,63;1,34;0,5701;1,75;2,25;✅ SÍ (+28.3%)
Slovan Liberec vs Sparta Praha;1,58;1,78;0,6525;1,53;1,94;✅ SÍ (+26.6%)
Bogotá vs Real Cartagena;1,64;1,35;0,5746;1,74;2,2;✅ SÍ (+26.4%)
Club Brugge vs Union Saint-Gilloise;1,93;1,69;0,7008;1,43;1,8;✅ SÍ (+26.1%)
Sport Recife vs CRB;1,58;1,66;0,6284;1,59;2,0;✅ SÍ (+25.7%)
Barranquilla vs Unión Magdalena;1,78;1,53;0,6426;1,56;1,95;✅ SÍ (+25.3%)
El Geish vs Pharco;1,27;1,13;0,4303;2,32;2,88;✅ SÍ (+23.9%)
CS U Craiova vs Universitatea Cluj;1,63;1,38;0,579;1,73;2,1;✅ SÍ (+21.6%)
Panathinaikos vs PAOK;1,49;1,55;0,5857;1,71;2,05;✅ SÍ (+20.1%)
Atlético PR vs Flamengo;1,52;1,42;0,5632;1,78;2,1;✅ SÍ (+18.3%)
Hradec Králové vs Slavia Praha;1,3;2,05;0,6505;1,54;1,81;✅ SÍ (+17.7%)
Colo-Colo vs Ñublense;1,69;1,28;0,5701;1,75;2,05;✅ SÍ (+16.9%)
Patronato vs Chacarita Juniors;1,33;1,05;0,4251;2,35;2,72;✅ SÍ (+15.6%)
Albion vs Wanderers;1,4;1,48;0,5494;1,82;2,1;✅ SÍ (+15.4%)
Athletic Club vs Juventude;1,3;1,06;0,4198;2,38;2,75;✅ SÍ (+15.4%)
Almagro vs San Martín San Juan;1,19;0,88;0,3423;2,92;3,35;✅ SÍ (+14.7%)
Athletic Club Bilbao vs Celta de Vigo;1,66;1,09;0,5185;1,93;2,2;✅ SÍ (+14.1%)
Petrojet vs Coca-Cola;1,34;1,18;0,4613;2,17;2,45;✅ SÍ (+13.0%)
Lechia Gdańsk vs Legia Warszawa;1,71;1,67;0,6564;1,52;1,72;✅ SÍ (+12.9%)
Chapecoense vs Remo;1,55;1,3;0,5424;1,84;2,05;✅ SÍ (+11.2%)
CA Osasuna vs RCD Espanyol;1,61;1,28;0,5517;1,81;2,0;✅ SÍ (+10.3%)
Ismaily SC vs Masr;1,02;1,25;0,396;2,53;2,78;✅ SÍ (+10.1%)
