Partido;xG Local;xG Visit;Prob. Over 2.5;Nuestra Cuota;Cuota Casa;¿Hay Valor?
Leganés vs SD Huesca;1,52;1,02;0,4664;2,14;1,9;❌ NO
Arsenal vs Burnley;1,85;0,98;0,5377;1,86;1,4;❌ NO
Guayaquil City FC vs Orense SC;1,02;1,14;0,3665;2,73;2,25;❌ NO
Sichuan Jiuniu vs Dalian Zhixing;1,44;1,31;0,5185;1,93;1,9;❌ NO
Tianjin Teda vs Henan Jianye;1,01;1,05;0,3396;2,94;2,15;❌ NO
Qingdao Youth Island vs Beijing Guoan;1,28;1,43;0,5088;1,97;1,79;❌ NO
Chengdu Better City FC vs Shanghai SIPG;2,06;0,99;0,5879;1,7;1,47;❌ NO
Ried vs Wolfsberger AC;1,31;1,27;0,4765;2,1;1,93;❌ NO
Defensores de Belgrano vs Chaco For Ever;1,16;1,04;0,3773;2,65;2,87;✅ SÍ (+8.3%)
Envigado vs Deportes Quindío;1,54;1,05;0,4791;2,09;2,2;✅ SÍ (+5.4%)
Internacional Palmira vs Tigres;1,57;0,98;0,4689;2,13;2,2;✅ SÍ (+3.2%)
Deportivo Maldonado vs Danubio;1,55;0,95;0,4562;2,19;2,25;✅ SÍ (+2.6%)
Ponte Preta vs Londrina;1,48;1,1;0,4765;2,1;2,45;✅ SÍ (+16.8%)
All Boys vs Deportivo Morón;1,54;1,49;0,5835;1,71;3,48;✅ SÍ (+103.1%)
